{
  "$schema": "./modules.schema.json",
  "version": "4.3.0",
  "generated_at": "2025-12-08T00:00:00Z",
  "modules": [
    {
      "id": "tenants",
      "name": "Multi-Tenant Management",
      "description": "Gestión de múltiples tenants M365/Azure AD",
      "version": "4.1.0",
      "status": "active",
      "category": "core",
      "icon": "Building2",
      "color": "#3B82F6",
      "routes": {
        "prefix": "/tenants",
        "file": "api/routes/tenants.py",
        "auth_required": false
      },
      "service": {
        "file": "api/services/multi_tenant.py",
        "singleton": "multi_tenant"
      },
      "model": null,
      "frontend": {
        "page": "frontend-react/src/pages/TenantsPage.jsx",
        "components": [
          "TenantList",
          "TenantOnboard",
          "TenantStats"
        ]
      },
      "features": [
        "CRUD tenants",
        "Onboarding con validación",
        "Estadísticas por tenant",
        "Switch de tenant activo"
      ],
      "dependencies": [],
      "api_endpoints": [
        {"method": "GET", "path": "/", "description": "Listar tenants"},
        {"method": "GET", "path": "/active", "description": "Tenant activo"},
        {"method": "GET", "path": "/{tenant_id}", "description": "Obtener tenant"},
        {"method": "POST", "path": "/onboard", "description": "Onboarding"},
        {"method": "PUT", "path": "/{tenant_id}", "description": "Actualizar"},
        {"method": "DELETE", "path": "/{tenant_id}", "description": "Eliminar"},
        {"method": "POST", "path": "/{tenant_id}/activate", "description": "Activar"},
        {"method": "POST", "path": "/{tenant_id}/analyze", "description": "Ejecutar análisis"}
      ]
    },
    {
      "id": "credentials",
      "name": "Credential Analysis",
      "description": "Análisis de credenciales filtradas (HIBP, Dehashed)",
      "version": "4.1.0",
      "status": "active",
      "category": "forensics",
      "icon": "Key",
      "color": "#EF4444",
      "routes": {
        "prefix": "/forensics/credentials",
        "file": "api/routes/credentials.py",
        "auth_required": true
      },
      "service": {
        "file": "api/services/credential_check.py",
        "singleton": "credential_checker"
      },
      "model": null,
      "frontend": {
        "page": "frontend-react/src/pages/CredentialsPage.jsx",
        "components": [
          "CredentialChecker",
          "BreachResults",
          "DomainSearch"
        ]
      },
      "features": [
        "Búsqueda HIBP",
        "Búsqueda Dehashed",
        "Análisis de stealer logs",
        "Exportación IOCs"
      ],
      "dependencies": ["cases"],
      "api_endpoints": [
        {"method": "POST", "path": "/check", "description": "Verificar credenciales"},
        {"method": "POST", "path": "/domain", "description": "Buscar por dominio"},
        {"method": "GET", "path": "/breaches/{email}", "description": "Brechas por email"}
      ]
    },
    {
      "id": "hunting",
      "name": "Threat Hunting",
      "description": "Queries de hunting contra M365, endpoints y SIEM",
      "version": "4.3.0",
      "status": "active",
      "category": "detection",
      "icon": "Crosshair",
      "color": "#8B5CF6",
      "routes": {
        "prefix": "/hunting",
        "file": "api/routes/hunting.py",
        "auth_required": true
      },
      "service": {
        "file": "api/services/hunting.py",
        "singleton": "hunting_service"
      },
      "model": {
        "file": "api/models/hunting.py",
        "classes": ["HuntQuery", "HuntResult"]
      },
      "frontend": {
        "page": "frontend-react/src/modules/ThreatHunting/HuntingPage.jsx",
        "components": [
          "HuntQueryList",
          "HuntExecutor",
          "HuntResults",
          "MitreMapping"
        ]
      },
      "features": [
        "Queries KQL predefinidas",
        "Queries OSQuery",
        "Reglas Sigma",
        "Análisis LLM de resultados",
        "Mapeo MITRE ATT&CK"
      ],
      "dependencies": ["tenants", "llm"],
      "api_endpoints": [
        {"method": "GET", "path": "/", "description": "Estado del servicio"},
        {"method": "GET", "path": "/queries", "description": "Listar queries"},
        {"method": "GET", "path": "/queries/{query_id}", "description": "Obtener query"},
        {"method": "POST", "path": "/execute", "description": "Ejecutar hunt"},
        {"method": "POST", "path": "/execute/custom", "description": "Hunt personalizado"},
        {"method": "GET", "path": "/results/{case_id}", "description": "Resultados por caso"},
        {"method": "POST", "path": "/queries/save", "description": "Guardar query"},
        {"method": "GET", "path": "/categories", "description": "Categorías MITRE"},
        {"method": "GET", "path": "/mitre", "description": "Cobertura MITRE"},
        {"method": "POST", "path": "/batch", "description": "Ejecutar batch"}
      ]
    },
    {
      "id": "timeline",
      "name": "Forensic Timeline",
      "description": "Línea de tiempo de eventos con correlación",
      "version": "4.3.0",
      "status": "active",
      "category": "analysis",
      "icon": "Clock",
      "color": "#10B981",
      "routes": {
        "prefix": "/timeline",
        "file": "api/routes/timeline.py",
        "auth_required": true
      },
      "service": {
        "file": "api/services/timeline.py",
        "singleton": "timeline_service"
      },
      "model": {
        "file": "api/models/timeline.py",
        "classes": ["TimelineEvent"]
      },
      "frontend": {
        "page": "frontend-react/src/modules/Timeline/TimelinePage.jsx",
        "components": [
          "TimelineView",
          "EventCard",
          "CorrelationGraph",
          "TimelineExport"
        ]
      },
      "features": [
        "Timeline visual interactivo",
        "Correlación de eventos",
        "Importación desde herramientas",
        "Exportación JSON/CSV",
        "Marcado de eventos clave"
      ],
      "dependencies": ["cases"],
      "api_endpoints": [
        {"method": "GET", "path": "/", "description": "Estado del servicio"},
        {"method": "GET", "path": "/{case_id}", "description": "Timeline de caso"},
        {"method": "POST", "path": "/events", "description": "Agregar evento"},
        {"method": "POST", "path": "/events/bulk", "description": "Agregar múltiples"},
        {"method": "GET", "path": "/events/{event_id}", "description": "Obtener evento"},
        {"method": "PUT", "path": "/events/{event_id}", "description": "Actualizar evento"},
        {"method": "DELETE", "path": "/events/{event_id}", "description": "Eliminar evento"},
        {"method": "POST", "path": "/correlate", "description": "Correlacionar eventos"},
        {"method": "GET", "path": "/{case_id}/correlations", "description": "Correlaciones"},
        {"method": "GET", "path": "/{case_id}/summary", "description": "Resumen timeline"},
        {"method": "GET", "path": "/{case_id}/graph", "description": "Datos para gráfico"},
        {"method": "POST", "path": "/{case_id}/import/{source}", "description": "Importar"},
        {"method": "GET", "path": "/{case_id}/export", "description": "Exportar"}
      ]
    },
    {
      "id": "reports",
      "name": "Report Generator",
      "description": "Generación de reportes PDF/HTML con LLM",
      "version": "4.3.0",
      "status": "active",
      "category": "output",
      "icon": "FileText",
      "color": "#F59E0B",
      "routes": {
        "prefix": "/reports",
        "file": "api/routes/reports.py",
        "auth_required": true
      },
      "service": {
        "file": "api/services/reports.py",
        "singleton": "reports_service"
      },
      "model": {
        "file": "api/models/reports.py",
        "classes": ["ForensicReport", "ReportSection"]
      },
      "frontend": {
        "page": "frontend-react/src/modules/Reports/ReportsPage.jsx",
        "components": [
          "ReportGenerator",
          "ReportViewer",
          "TemplateEditor",
          "ReportList"
        ]
      },
      "features": [
        "Reportes técnicos PDF",
        "Reportes ejecutivos",
        "Cadena de custodia",
        "Templates personalizados",
        "Resumen LLM automático"
      ],
      "dependencies": ["cases", "timeline", "llm"],
      "api_endpoints": [
        {"method": "GET", "path": "/", "description": "Estado del servicio"},
        {"method": "POST", "path": "/generate", "description": "Generar reporte"},
        {"method": "GET", "path": "/case/{case_id}", "description": "Reportes de caso"},
        {"method": "GET", "path": "/{report_id}", "description": "Obtener reporte"},
        {"method": "GET", "path": "/{report_id}/status", "description": "Estado generación"},
        {"method": "GET", "path": "/{report_id}/download", "description": "Descargar"},
        {"method": "POST", "path": "/{report_id}/regenerate", "description": "Regenerar"},
        {"method": "DELETE", "path": "/{report_id}", "description": "Eliminar"},
        {"method": "GET", "path": "/templates", "description": "Listar templates"},
        {"method": "POST", "path": "/templates", "description": "Crear template"},
        {"method": "GET", "path": "/sections", "description": "Secciones disponibles"},
        {"method": "POST", "path": "/preview", "description": "Preview reporte"},
        {"method": "POST", "path": "/batch", "description": "Generar batch"}
      ]
    },
    {
      "id": "llm",
      "name": "LLM Provider",
      "description": "Proveedor LLM agnóstico (LM Studio, Ollama)",
      "version": "4.3.0",
      "status": "active",
      "category": "ai",
      "icon": "Brain",
      "color": "#EC4899",
      "routes": {
        "prefix": "/llm",
        "file": "api/routes/llm_settings.py",
        "auth_required": true
      },
      "service": {
        "file": "api/services/llm_provider.py",
        "singleton": "LLMManager (via get_llm_manager)"
      },